{
  "schema_version": 1,
  "enrollment_id": "usb-4568eb4a9e23aaa5",
  "identity_fingerprint": "4568eb4a9e23aaa550726d1ce430057937a24ae0f473a9a606d05c4a9d256b48",
  "capacity_bytes": 137438953472,
  "filesystem": "luks2-ext4",
  "challenge": "0123456789abcdef0123456789abcdef",
  "created_at": "2026-07-19T12:00:00Z",
  "first_confirmation": "ERASE usb-4568eb4a9e23aaa5",
  "second_confirmation": "ERASE usb-4568eb4a9e23aaa5 4568eb4a9e23aaa5 0123456789abcdef0123456789abcdef"
}
